{
  "schema_version": "1.0",
  "candidate_id": "unbuilt-2026-07-29",
  "generated_at": "2026-07-29T02:00:00Z",
  "templates": [
    {"template_key":"ubuntu-qemu","template_version":"unverified","runtime_kind":"qemu","status":"mechanics_validated","genuine_workload":true,"image":null,"bootstrap":{"status":"passed","evidence_id":null},"console":{"status":"passed","evidence_id":null},"capabilities":{"status":"blocked","evidence_id":null},"lifecycle":{"status":"passed","evidence_id":null},"cleanup":{"status":"not_tested","evidence_id":null},"exception_id":null},
    {"template_key":"vyos","template_version":"operator-supplied","runtime_kind":"qemu","status":"blocked","genuine_workload":false,"image":null,"bootstrap":{"status":"blocked","evidence_id":null},"console":{"status":"blocked","evidence_id":null},"capabilities":{"status":"blocked","evidence_id":null},"lifecycle":{"status":"blocked","evidence_id":null},"cleanup":{"status":"not_tested","evidence_id":null},"exception_id":null},
    {"template_key":"fancywan","template_version":"operator-supplied","runtime_kind":"qemu","status":"blocked","genuine_workload":false,"image":null,"bootstrap":{"status":"blocked","evidence_id":null},"console":{"status":"blocked","evidence_id":null},"capabilities":{"status":"blocked","evidence_id":null},"lifecycle":{"status":"blocked","evidence_id":null},"cleanup":{"status":"not_tested","evidence_id":null},"exception_id":null},
    {"template_key":"fortigate","template_version":"license-review-required","runtime_kind":"qemu","status":"blocked","genuine_workload":false,"image":null,"bootstrap":{"status":"not_applicable","evidence_id":null},"console":{"status":"blocked","evidence_id":null},"capabilities":{"status":"blocked","evidence_id":null},"lifecycle":{"status":"blocked","evidence_id":null},"cleanup":{"status":"not_tested","evidence_id":null},"exception_id":null},
    {"template_key":"busybox-container","template_version":"digest-required","runtime_kind":"docker","status":"mechanics_validated","genuine_workload":true,"image":null,"bootstrap":{"status":"not_applicable","evidence_id":null},"console":{"status":"passed","evidence_id":null},"capabilities":{"status":"passed","evidence_id":null},"lifecycle":{"status":"passed","evidence_id":null},"cleanup":{"status":"not_tested","evidence_id":null},"exception_id":null},
    {"template_key":"ubuntu-container","template_version":"digest-required","runtime_kind":"docker","status":"mechanics_validated","genuine_workload":true,"image":null,"bootstrap":{"status":"not_applicable","evidence_id":null},"console":{"status":"passed","evidence_id":null},"capabilities":{"status":"passed","evidence_id":null},"lifecycle":{"status":"passed","evidence_id":null},"cleanup":{"status":"not_tested","evidence_id":null},"exception_id":null}
  ]
}
